<?xml version="1.0" encoding="UTF-8" standalone="yes"?>
<!--

    Licensed to Apereo under one or more contributor license
    agreements. See the NOTICE file distributed with this work
    for additional information regarding copyright ownership.
    Apereo licenses this file to you under the Apache License,
    Version 2.0 (the "License"); you may not use this file
    except in compliance with the License.  You may obtain a
    copy of the License at the following location:

      http://www.apache.org/licenses/LICENSE-2.0

    Unless required by applicable law or agreed to in writing,
    software distributed under the License is distributed on an
    "AS IS" BASIS, WITHOUT WARRANTIES OR CONDITIONS OF ANY
    KIND, either express or implied.  See the License for the
    specific language governing permissions and limitations
    under the License.

-->
<permission-owner xmlns="https://source.jasig.org/schemas/uportal/io/permission-owner" xmlns:ns2="https://source.jasig.org/schemas/uportal/io/stylesheet-descriptor" xmlns:ns3="https://source.jasig.org/schemas/uportal/io/portlet-definition" xmlns:ns4="https://source.jasig.org/schemas/uportal" xmlns:ns5="https://source.jasig.org/schemas/uportal/io/portlet-type" xmlns:ns6="https://source.jasig.org/schemas/uportal/io/user" xmlns:xsi="http://www.w3.org/2001/XMLSchema-instance" version="4.0" xsi:schemaLocation="https://source.jasig.org/schemas/uportal/io/permission-owner https://source.jasig.org/schemas/uportal/io/permission-owner/permission-owner-4.0.xsd">
    <name>Portlet Publishing</name>
    <fname>UP_PORTLET_PUBLISH</fname>
    <desc>Permissions controlling the publishing and editing of uPortal content</desc>
    <activity>
        <name>Select Portlet Type</name>
        <fname>SELECT_PORTLET_TYPE</fname>
        <desc>Select the specified portlet type when publishing a new portlet.</desc>
        <targetProvider>portletTypeTargetProvider</targetProvider>
    </activity>
    <activity>
        <name>Manage Created</name>
        <fname>MANAGE_CREATED</fname>
        <desc>Create uPortal content (portlets).</desc>
        <targetProvider>channelsAndCategoriesTargetProvider</targetProvider>
    </activity>
    <activity>
        <name>Manage Approved</name>
        <fname>MANAGE_APPROVED</fname>
        <desc>Manage approved uPortal content (portlets).  This permission also implies the ability to create portlets.</desc>
        <targetProvider>channelsAndCategoriesTargetProvider</targetProvider>
    </activity>
    <activity>
        <name>Manage Published</name>
        <fname>MANAGE</fname>
        <desc>Manage published uPortal content (portlets).  This permission also implies the ability to create and approve portlets.</desc>
        <targetProvider>channelsAndCategoriesTargetProvider</targetProvider>
    </activity>
    <activity>
        <name>Manage Expired</name>
        <fname>MANAGE_EXPIRED</fname>
        <desc>Manage expired uPortal content (portlets).  This permission also implies the ability to create, approve, and publish portlets.</desc>
        <targetProvider>channelsAndCategoriesTargetProvider</targetProvider>
    </activity>
    <activity>
        <name>Manage Maintenance</name>
        <fname>MANAGE_MAINTENANCE</fname>
        <desc>Manage uPortal content (portlets) in MAINTENANCE mode.  This permission also implies the ability to create, approve, publish, and expire portlets.</desc>
        <targetProvider>channelsAndCategoriesTargetProvider</targetProvider>
    </activity>
    <activity>
        <name>Configure</name>
        <fname>PORTLET_MODE_CONFIG</fname>
        <desc>Access the configuration mode of a portlet.</desc>
        <targetProvider>channelsAndCategoriesTargetProvider</targetProvider>
    </activity>
</permission-owner>
